{
  "event_id": "evt_00000003",
  "persona_id": "per_Aurora0001",
  "seq": 3,
  "type": "input.read",
  "occurred_at": "2026-10-11T18:00:00Z",
  "life_time_ms": 4200,
  "source": {
    "kind": "core",
    "ref": "attention"
  },
  "causes": [
    "evt_00000002"
  ],
  "idempotency_key": "rd:inp_00000001",
  "state_version": 2,
  "changes_state": true,
  "payload": {
    "input_id": "inp_00000001"
  },
  "schema_version": 1
}
